{
  "surface": "canon-drafter",
  "schema_version": "1.0",
  "canon_constraints": {
    "continuity": "Star Wars Legends (Expanded Universe), post-Fate of the Jedi, 47 ABY. Crucible (45 ABY) canonical; Legacy comics did NOT happen; the One Sith on Korriban remain in patient pre-emergence under Darth Krayt, glimpsed only as an off-page hand.",
    "divergence_point": "Diverges from published Legends continuity by (a) excising the Legacy comics future entirely — no Darth Krayt galactic war, no Cade Skywalker, no fall of the Galactic Alliance to the One Sith; (b) introducing Aevyn Soris, a marginal Force-sensitive Jedi-rejected at fourteen who joined the GAG as a young adult and became Jacen Solo's side-project Force student during the Caedus period (Ben Skywalker remained Jacen's primary fourteen-year-old apprentice; Aevyn lived in the gaps); (c) introducing Jacen's unfinished holocron — a working device assembled during the LotF period systematizing Recognition, Deepening, and Holding — hidden on Iresh in old GAG-era survey/storage equipment near the Glasswell; (d) introducing the Shedu Maad Memorial Foundation as a legitimate post-war veterans' charity whose hidden inner ring (the Vigil) preserves Jacen-derived 'clarity, resilience, steadiness, preparation' ideology and seeks to recover and finish the holocron.",
    "canon_preserved": [
      "Ben Skywalker as Jedi Knight, son of Luke Skywalker and Mara Jade Skywalker; aged ~21 in 47 ABY.",
      "Jacen Solo's fall to Darth Caedus during the Legacy of the Force period and his murder of Mara Jade.",
      "Ben's service in the Galactic Alliance Guard (GAG) under Jacen as a fourteen-year-old, and Ben's later turn against Caedus by the end of the war.",
      "The Abeloth crisis and the broader Fate of the Jedi arc (Daala, Lost Tribe of Sith, Vestara Khai), resolved before Book 1 opens.",
      "Crucible (45 ABY): Luke, Leia, and Han have a transcendent Mortis-adjacent metaphysical encounter; Luke and Leia briefly become luminous beings before being called back; the three emerge changed and effectively retired from active galactic crisis-management work.",
      "The Jedi Order's permanent relocation to Shedu Maad in the Hapes Cluster at the end of FOTJ (44 ABY), after the Senate voted to remove them from Coruscant following the Lost Tribe crisis.",
      "Saba Sebatyne as Grand Master, having assumed the title at the end of FOTJ when Luke stepped down. Luke is a senior Master on the Council, still active, no longer Grand Master.",
      "Wynn Dorvan as Chief of State of the Galactic Alliance, in return-to-normalcy mode after repeated crises (Yuuzhan Vong, Killik, Caedus, Daala, Abeloth, Lost Tribe).",
      "Jagged Fel as Head of State of the Imperial Remnant; Tenel Ka Djo as Queen Mother of Hapes.",
      "Vestara Khai canonically alive and active off-page under the alias 'Savara Raine' as a free-agent dark-side-trained contractor (per Crucible) — never on-page in Book 1.",
      "Tahiri Veila as a Jedi Knight in good standing at Shedu Maad in 47 ABY, Ben's recent working colleague — single passing reference allowed, never as a Caedus reference.",
      "The One Sith on Korriban under Darth Krayt as a real organization in patient pre-emergence, never on-page beyond a single off-page 'hand'.",
      "Jacen Solo's Force odyssey (NJO-LotF transition) as the source-material for his later systematization of Recognition / Deepening / Holding: Vergerean thought; Lumiya's Sith inheritance; experiments performed during the GAG/Caedus period.",
      "Standard Legends Force ontology: light and dark as natural moral-polar properties; Force wounds remain wounds; holocrons as crystalline storage devices for Jedi or Sith teachings."
    ],
    "canon_overridden": [
      "Legacy comics continuity (Star Wars: Legacy / Cade Skywalker / Krayt-led galactic war) — entirely excised. The One Sith remain on Korriban in pre-emergence; they do not invade or seize the Galactic Alliance.",
      "Aevyn Soris is a NEW character (not in published Legends): one of Jacen Solo's surviving Force students from the GAG/Caedus period, established as a side project running alongside Jacen's primary apprenticeship of Ben.",
      "The duplicated wartime quarantine/survey shipment manifest personally encrypted by Jacen Solo shortly before the Battle of Shedu Maad is a NEW canonical artifact specific to this novel.",
      "The unfinished holocron's specific contents — Jacen's systematized Recognition, Deepening, and Holding work as identity-shaping technique categories — are this novel's named extrapolation from Jacen's canonical Force-odyssey behavior. Compatible with established Legends; not previously named in published material.",
      "The Shedu Maad Memorial Foundation (public charity), the Vigil (hidden inner ring), Greyline Strategic Services (Tess's firm), and Cinderline (mercenary contractor arm) are NEW post-war Coruscant-political institutions introduced for this novel.",
      "Iresh (remote wind-scoured planet near the edge of known space) and the Glasswell (taboo sinkhole/cavern beneath a mirror-lake, pale translucent mineral) are NEW Outer Rim locations introduced for this novel. Iresh's Force character — preserves charged impressions of memory/identity/decision but does NOT reveal truth or prophecy — is original to this novel and does NOT extend Mortis-adjacent mythology.",
      "Tarn Velos Coastal Detention Works (storm-lashed industrial coastal prison world) and Civitas Archive Systems (Coruscant civic-records restoration and compliance firm) are NEW Book 1 settings.",
      "Allana Solo / Amelia is treated as a dangerous gray zone in adversary awareness only — referenced obliquely in Ch 37 from the Vigil/One Sith POV ('the Hapan question' / 'the unresolved succession thread'). Never named on-page; never enters Ben's awareness. Her identity remains publicly deniable in-universe."
    ],
    "style_constraints": [
      "Capitalize 'Human' per Lucasfilm style guide.",
      "Decapitalize 'galaxy' in all contexts unless starting a sentence.",
      "American English spellings throughout.",
      "Star Wars vocabulary discipline: datapads not tablets, transparisteel not glass, durasteel not steel, turbolifts not elevators, comlinks not radios, blasters not guns.",
      "'Jedi' is both singular and plural — never 'Jedis'.",
      "'Darth' as a Sith title is capitalized when preceding a name; generic 'the Sith' lowercase.",
      "Hyperdrive classifications, ship specifications, and planetary names match Wookieepedia entries where existing canon applies.",
      "Do not write theme as thesis. Put theme into behavior, pressure, cost, and consequence.",
      "Do not imitate any specific published Star Wars author's prose. Use broad franchise feel only: cinematic clarity, adventure momentum, lived-in technology, dry humor, mythic Force awe when earned.",
      "Maintain a commercial reader-facing surface at all times: goal, obstacle, movement, reversal, hook.",
      "When in doubt, simplify the metaphysics and clarify the physical action.",
      "Ben should rarely name his fear directly. Other characters' reactions should often reveal it.",
      "Talon's jokes should either move the scene, hide fear, or puncture solemnity. Random quips are not enough.",
      "Aevyn's sympathy should arrive after dread, not before it. Never let Aevyn articulate his wound directly; surface it in fragments — a pause, a sharpness, a way his hand stills.",
      "Sela speaks from local survival knowledge, not Force theory.",
      "Luke is emotionally intelligent, not conveniently fooled. Never have Luke reference 'As Grand Master' for himself — he is no longer Grand Master.",
      "The One Sith remain a background shadow in Book 1 — glimpsed or implied only, never fully revealed.",
      "Emotion shown. Stakes clarified. Jargon minimized. Mystery preserved. Confusion avoided.",
      "The story should always make the current scene goal, immediate obstacle, result, and next danger legible to a Star Wars-aware reader who has not recently read the full Legends timeline.",
      "Explain only what the reader needs for the current emotional or plot decision. Keep exposition packets short (1-3 sentences). Return immediately to action, dialogue, or character reaction. Repeat essential context in different emotional forms rather than dumping it once.",
      "Investigation reader-facing vocabulary stays in physical thriller terms: fragment, duplicate manifest, quarantine disguise, archive, Foundation link, Iresh manifest/authorization. Avoid stacking abstract internal-system labels (no 'routing-index layer', 'black-channel routing grammar', 'stripped transfer shell', 'dead-channel ping', 'transfer node').",
      "No paragraph contains more than one invented bureaucratic/technical term. Every technical phrase translated to immediate human stakes within two sentences.",
      "Avoid 'system' as the default GAG metaphor; prefer logistics network, shipment trail, records chain, transfer chain, or operation.",
      "Use 'Jacen' for the pre-fall identity (mentor / cousin / Force teacher Ben once trusted). Use 'Caedus' for the Sith-Lord identity (the war crimes, the murder of Mara). POV characters choose between them by emotional load: Ben moves between both; Aevyn refuses 'Caedus' and uses 'Jacen' only; Aelia privately thinks of him as Jacen but never publicly defends 'Darth Caedus'; Tess avoids both names in operational dialogue.",
      "GAG = Galactic Alliance Guard. The full name appears once on first use (Ch 1 or Ch 2 narration), abbreviation thereafter. Same convention for the Foundation (Shedu Maad Memorial Foundation, then 'the Foundation').",
      "Crucible aftermath (Luke's post-Mortis state) is implication only — one quiet line of texture in Ch 3 first holo call (tired in a way Ben doesn't remember; eyes further away; longer pauses). Ben notices and does NOT ask. Mortis is never named on-page.",